{
  "formation_version": "1.0.0",
  "pass": "knowledge_synthesis",
  "terms": [
    {
      "id": "TERM.A01.KF.01",
      "name": "备案主体与免报",
      "definition": "备案主体按组织形式确定；资本和自然人股东等全部条件且承诺后方免报，与机构第十条免识别有别。",
      "aliases": [],
      "statement_ids": [
        "ST.NORM.SRC01.U0005.002",
        "ST.NORM.SRC01.U0005.004"
      ],
      "distinctions": "免报前须是应备案公司/合伙等主体；个体工商户不备案，金融机构免识别是另一义务。",
      "example": "小型自然人股东公司无第三方实际控制且正式承诺免报。",
      "counterexample": "资本900万但存在对外转让全部分红权，不可自动免报。"
    },
    {
      "id": "TERM.A01.KF.02",
      "name": "自然人受益所有人",
      "definition": "最终拥有、控制或受益必须是自然人，公司法和国资监管的实际控制企业不自动构成自然人结论。",
      "aliases": [],
      "statement_ids": [
        "ST.NORM.SRC01.U0005.007",
        "STM.SRC.SRC06.U0030.S01",
        "STM.SRC.SRC06.U0030.S02",
        "STM.SRC.SRC06.U0030.S03"
      ],
      "distinctions": "所有人必须是自然人；公司法/国资产权交易语境的控制主体可以是企业。",
      "example": "非股东自然人依据协议决定公司重大决策。",
      "counterexample": "仅认定B公司为A公司的实际控制企业不是自然人答案。"
    },
    {
      "id": "TERM.A01.KF.03",
      "name": "权益路径",
      "definition": "路径份额逐段连乘；同人不重合有效路径合计；中间公司控股不自动替换为全部权益。",
      "aliases": [],
      "statement_ids": [
        "ST.NORM.SRC02.U0019.001",
        "STM.SRC.SRC06.U0070.S01"
      ],
      "distinctions": "分别区分中间主体权益与自然人最终权益，多条不同路径才能累加。",
      "example": "同一自然人两条独立路径14%和17.5%，合计31.5%。",
      "counterexample": "把控制上层公司误算为上层全部股权归个人。"
    },
    {
      "id": "TERM.A01.KF.04",
      "name": "名义权益与真实权利",
      "definition": "登记持股与最终权益、收益、表决权或控制可经代持协议分离，须分别核证。",
      "aliases": [],
      "statement_ids": [
        "STM.SRC.SRC06.U0107.S01",
        "STM.SRC.SRC06.U0107.S02",
        "STM.SRC.SRC06.U0110.S01"
      ],
      "distinctions": "登记的法律持股与真实享有的收益、表决或最终控制是不同关系。",
      "example": "协议证实某名义股东代第三人持有权益。",
      "counterexample": "有亲属关系却没有权利转移证据，不得认定代持。"
    },
    {
      "id": "TERM.A01.KF.05",
      "name": "实际控制",
      "definition": "人事、决策、财务、重要财物最终支配能力，不是法定代表人头衔或签字权。",
      "aliases": [],
      "statement_ids": [
        "ST.NORM.SRC02.U0021.001",
        "ST.NORM.SRC02.U0021.003"
      ],
      "distinctions": "最终决定能力不同于仅为经理执行董事会决定、作为签字经办或标签控股。",
      "example": "出资1%普通合伙人却可决定人事、投资、财务。",
      "counterexample": "第一大股东无决策支配证据就被认定实际控制人。"
    },
    {
      "id": "TERM.A01.KF.06",
      "name": "备位管理人",
      "definition": "三类自然人标准确证均无人满足后的日常经营管理者视同路径，UNKNOWN不能当作不存在。",
      "aliases": [],
      "statement_ids": [
        "ST.NORM.SRC01.U0005.018",
        "STM.SRC.SRC06.U0057.S01",
        "STM.SRC.SRC06.U0057.S02"
      ],
      "distinctions": "只适用于三项识别标准确定均无人符合，不适用于证据缺失或结构未穿透。",
      "example": "已充分核实无持股、收益表决与控制者而确认日常管理人。",
      "counterexample": "代持协议仍缺失就直接填法定代表人。"
    },
    {
      "id": "TERM.A01.KF.07",
      "name": "国资控股与参股",
      "definition": "国有独资/控股视同法代和仅参股不再穿透国资部分，为不同适用事实。",
      "aliases": [],
      "statement_ids": [
        "ST.NORM.SRC01.U0005.019",
        "ST.NORM.SRC02.U0038.001"
      ],
      "distinctions": "国资参与≠国资控股；国资交易监管的实际控制类型不可直接代替受益所有人简化资格。",
      "example": "国资30%参股但甲持股60%，按一般标准识别甲。",
      "counterexample": "以存在一个国资股东直接认定整个公司法代为UBO。"
    },
    {
      "id": "TERM.A01.KF.08",
      "name": "信托最终有效控制",
      "definition": "信托四类当事人与能处分信托财产、决定投资分配、变更当事人的其他自然人分别核实。",
      "aliases": [],
      "statement_ids": [
        "ST.NORM.SRC02.U0041.001",
        "ST.NORM.SRC02.U0042.003"
      ],
      "distinctions": "受托人名称和受益人名册无法穷尽信托的最终支配安排，未指定时记录潜在范围。",
      "example": "某自然人虽非当事人却能撤换受托人。",
      "counterexample": "信托受益人待定就填‘无人需要识别’。"
    },
    {
      "id": "TERM.A01.KF.09",
      "name": "免识别与简化",
      "definition": "第十条类别豁免、第十一条依据类别及风险简化，不等于备案主体承诺免报。",
      "aliases": [],
      "statement_ids": [
        "ST.NORM.SRC02.U0023.001",
        "ST.NORM.SRC02.U0030.001"
      ],
      "distinctions": "免识别与简化对应第十/十一条不同门槛；承诺免报是备案主体的第三种性质。",
      "example": "确证为事业单位，可适用第十条免识别。",
      "counterexample": "名称含‘基金’就自动免识别或只登记法代。"
    },
    {
      "id": "TERM.A01.KF.10",
      "name": "形成时间",
      "definition": "自然人权利关系生效时间，有别于工商登记、识别核实和申报提交。",
      "aliases": [],
      "statement_ids": [
        "STM.SRC.SRC06.U0137.S01",
        "STM.SRC.SRC06.U0137.S02",
        "ST.NORM.SRC02.U0056.001"
      ],
      "distinctions": "形成日是法律关系何时生效，首次跨标、目前比例、登记、查询或申报时间应分离。",
      "example": "股权协议2023生效、工商2024变更，按协议生效事实核日。",
      "counterexample": "把核实当天2026日期当成历史权利形成日。"
    },
    {
      "id": "TERM.A01.KF.11",
      "name": "重大差异",
      "definition": "BOMIS与机构识别在人选、法定身份、关系类型或形成终止年月上的法定重大类别。",
      "aliases": [],
      "statement_ids": [
        "ST.NORM.SRC02.U0086.001",
        "ST.NORM.SRC02.U0088.002"
      ],
      "distinctions": "年月不同为重大；单纯日差但相同年月不自动属于此项重大。",
      "example": "2月28日与3月1日形成，虽然仅差1天仍跨月。",
      "counterexample": "采信第三方产品跨月相差30日豁免说法。"
    },
    {
      "id": "TERM.A01.KF.12",
      "name": "两种三十日期限",
      "definition": "备案主体权利变化30日与机构差异发现30工作日义务主体、起点和日历均不同。",
      "aliases": [],
      "statement_ids": [
        "ST.NORM.SRC01.U0005.023",
        "ST.NORM.SRC02.U0084.002"
      ],
      "distinctions": "备案30日从权利事实变化起算；金融机构差异30工作日从发现差异起算。",
      "example": "客户9月变更权利，而银行10月发现系统差异，分别计时。",
      "counterexample": "把自然日截止与工作日截止直接设成同一天。"
    },
    {
      "id": "TERM.A01.KF.13",
      "name": "自动辅助与人的判断",
      "definition": "自动查询/批量计算可辅助，不代替金融机构实质核实及风险判断。",
      "aliases": [],
      "statement_ids": [
        "ST.NORM.SRC02.U0013.002",
        "ST.NORM.SRC02.U0013.003"
      ],
      "distinctions": "BOMIS查询只是事实线索；法定责任要求机构独立核实并形成有权风险判断。",
      "example": "自动识别得到候选人后由机构核协议与权利生效日。",
      "counterexample": "仅凭接口返回一致就标记风险核实通过。"
    }
  ],
  "rules": [
    {
      "id": "RULE.A01.KF.SCOPE",
      "name": "备案主体、免报资格与责任",
      "statement_ids": [
        "ST.NORM.SRC01.U0005.002",
        "ST.NORM.SRC01.U0005.003",
        "ST.NORM.SRC01.U0005.004",
        "ST.NORM.SRC01.U0005.021",
        "STM.SRC.SRC06.U0035.S01",
        "STM.SRC.SRC06.U0035.S02",
        "STM.SRC.SRC06.U0125.S01"
      ],
      "question_ids": [
        "Q.A01.S01",
        "Q.A01.S02",
        "Q.A01.S03",
        "Q.A01.S04",
        "Q.A01.S05"
      ],
      "rule_class": "NORMATIVE",
      "impact": "HIGH",
      "scope": "备案主体（公司、合伙企业、外国公司分支机构）及个体工商户",
      "preconditions": "目标在2024年11月1日之后的中国备案义务范围内；识别登记主体本人，而非股东、分支母公司或机构开户客户的混合概念。",
      "conditions": "先确认登记性质：个体工商户无备案义务；外国公司分支机构须备案且不适用承诺免报；只有适用承诺免报的境内公司或合伙企业同时满足注册资本/出资额≤1000万元（含等值外币）、股东/合伙人全为自然人、没有股东/合伙人以外自然人实际控制或获益且无通过权益以外方式控制或获益，完成承诺后才能免备案。",
      "result": "外国公司分支机构须备案且不适用承诺免报；境内公司或合伙企业的全套免报条件均证实并完成承诺时才免备案，任一项不成立仍须备案。",
      "exceptions": "未能确认任一自然人股东背后的代持或协议控制，不认定免报成立；登记股东全为自然人不能独立证明无其他控制或收益。",
      "missing_evidence": "登记文件、完整股东/合伙人名册及出资额、章程和受益/表决/控制安排、主体关于条件的承诺；外币等值核对口径需有依据。",
      "effective_period": "2024-11-01 起；免报资格变化之日触发30日备案义务。",
      "authority": "正式办法直接规定的识别、备案及核对义务；依据：2024年第3号令、人民银行备案指南第二版",
      "origin": "SOURCE_STATED",
      "review_status": "PENDING",
      "dispute_status": "UNCONTESTED",
      "conflict_ids": [],
      "business_conclusion": "承诺免报仅是符合全部条件的境内公司或合伙企业可走的例外；外国公司分支在中国须备案、不得承诺免报，不因本国申报豁免改变。",
      "required_facts": [
        "目标登记为公司、合伙企业、外国公司分支机构或个体工商户的确定类型及设立/判断日期。",
        "登记资本或合伙出资额、币种和等值人民币数；股东/合伙人是否全为自然人。",
        "股东之外是否有人实际控制/获益、或借代持及权益以外安排控制/获益，并取得承诺事实。"
      ],
      "decision_steps": [
        "若为个体工商户，则无本办法备案义务；若为登记在范围内的主体，先确定原则上须备案。",
        "仅对可适用承诺免报的主体，把资本≤1000万元、股东全为自然人、无人额外控制/获益及无其他方式控制/获益作为同时条件逐项核验；任一条件为否即不得免报。",
        "全部成立且完成承诺才确定免报；外国公司分支不套用其本国申报豁免，仍按中国规定处理。"
      ],
      "evidence_requirements": [
        "主体官方登记类别和设立时间、资本出资额及外币折算依据；完整股东/合伙人名册。",
        "章程、合伙协议、代持与收益/表决/控制安排、相关方承诺及适用日版本。"
      ],
      "non_sufficient_facts": [
        "只有自然人登记股东、资本低于1000万元的截图，不能证明股东以外无人控制或取益。",
        "没有发现代持材料不等于能确认不存在代持；外国本国豁免无中国备案效力。"
      ],
      "unknown_behavior": "资本等值、真实股东身份或额外控制/获益任一条件未核实，免报资格为UNKNOWN；只保留原则上须备案及补充查验结论，不能代主体承诺。需调外币计算材料和权利安排原件。",
      "human_boundary": "主体有权负责人核对免报全条件并作承诺；金融机构只能把该事实作为尽调线索并单独判断自身识别，不代主体确认备案资格。",
      "case_ids": [
        "CASE.A01.KF.SCOPE.B"
      ]
    },
    {
      "id": "RULE.A01.KF.FILING",
      "name": "备案初次与变化后的期限",
      "statement_ids": [
        "ST.NORM.SRC01.U0005.022",
        "ST.NORM.SRC01.U0005.023",
        "ST.NORM.SRC01.U0005.032",
        "STM.SRC.SRC06.U0032.S01",
        "STM.SRC.SRC06.U0032.S02"
      ],
      "question_ids": [
        "Q.A01.S07",
        "Q.A01.S08",
        "Q.A01.P25"
      ],
      "rule_class": "NORMATIVE",
      "impact": "HIGH",
      "scope": "依法须备案的主体；分别判新设、设立无法系统办理及实施前已登记",
      "preconditions": "辨明主体设立登记发生在办法施行前还是施行后，是否能通过登记系统设立及备案，以及是否先曾合法承诺免报。",
      "conditions": "新设登记时系统备案；无法系统设立登记可现场登记并自登记日起30日内系统备案；受益人信息变更或承诺免报条件消失自变化日起30日系统备案；实施前已登记主体按办法2025-11-01前完成。",
      "result": "按设立或变更类别从相应事实日起分别办理初始或更新备案；实施前存量主体遵循正式办法截止日。",
      "exceptions": "指南第二版的‘及时补报’不可擅自消灭正式办法明确的存量期限；身份变动与免报条件变化起算事实不同。",
      "missing_evidence": "设立登记日、系统可办状态、历史登记档案、权利变更生效文件、原免报承诺与条件变化材料。",
      "effective_period": "备案义务自2024-11-01起；存量截止点以正式办法文本为准；现在须检查是否迟报，不逆向假造按时备案。",
      "authority": "正式办法直接规定的识别、备案及核对义务；依据：2024年第3号令、人民银行备案指南第二版",
      "origin": "SOURCE_STATED",
      "review_status": "PENDING",
      "dispute_status": "UNCONTESTED",
      "conflict_ids": [],
      "business_conclusion": "确认具体登记日和权利/免报条件变化日后分别起算，不以第二版指南‘及时’改写正式办法日期。",
      "required_facts": [
        "主体设立登记日期、登记注册系统能否完成设立及受益人备案。",
        "原受益人或免报条件具体何时改变，改变的权利关系何时法律生效。",
        "施行前登记主体的存量状态、是否在正式办法截止日之前完成备案。"
      ],
      "decision_steps": [
        "新设能在系统办理时随设立备案；不能通过系统设立则现场设立并从该登记日起30日系统备案。",
        "信息变化从受益人权利实际变化日起，免报条件消失从不符合之日起，各30日更新/备案；不要从银行发现差异日起算。",
        "施行前已登记主体按正式办法2025-11-01截止日核验；指南‘及时补报’不能取代这一正式期限。"
      ],
      "evidence_requirements": [
        "设立登记及备案回执、无法通过系统设立的材料和现场办理记录。",
        "章程转让/控制协议的实际生效材料、原承诺文件及失效证据。"
      ],
      "non_sufficient_facts": [
        "知道登记年份但不知道具体登记日，不足以确认‘30日内’是否按时。",
        "金融机构查询发现日不等于主体权利变化日；二版指南措辞不能更改办法期限。"
      ],
      "unknown_behavior": "登记或变化生效日期缺失时备案义务主体仍明确，但是否逾期和精确截止日UNKNOWN；要求补登记回执及变更生效资料，不能把查询日填作变化日。",
      "human_boundary": "备案主体有权人员确认事实发生时间和完成提交；金融机构若发现未备案另履行提示与差异反馈，不代主体认定其申报已履行。",
      "case_ids": [